{
  "version": "v0.16.0",
  "schemaVersion": 1,
  "source": {
    "name": "国家中小学智慧教育平台",
    "url": "https://basic.smartedu.cn/",
    "note": "平台「教材」「课程教学」栏目提供《义务教育课程方案和课程标准（2022年版）》各学科课程标准原文与电子教材，是本项目课标条目的权威出处。"
  },
  "standards": [
    {
      "code": "math-2022:S1:NA:NO",
      "slug": "math-2022",
      "curriculum": "义务教育数学课程标准（2022年版）",
      "stage": "第一学段（1~2年级）",
      "domain": "数与代数",
      "theme": "数与运算",
      "summary": "万以内数的认识与表示；20以内、100以内加减法；表内乘除法；含括号的两步混合运算顺序。"
    },
    {
      "code": "math-2022:S1:NA:AR",
      "slug": "math-2022",
      "curriculum": "义务教育数学课程标准（2022年版）",
      "stage": "第一学段（1~2年级）",
      "domain": "数与代数",
      "theme": "数量关系",
      "summary": "在真实情境中运用加、减、乘、除的意义解决问题，认识部分与整体、两数相差、倍数等基本数量关系。"
    },
    {
      "code": "math-2022:S1:GG:GM",
      "slug": "math-2022",
      "curriculum": "义务教育数学课程标准（2022年版）",
      "stage": "第一学段（1~2年级）",
      "domain": "图形与几何",
      "theme": "图形的认识与测量",
      "summary": "认识长方体、正方体、圆柱、球等立体图形和长方形、正方形、圆、三角形等平面图形；体验长度、质量、时间等量的意义，认识厘米、米、克、千克、时、分、秒。"
    },
    {
      "code": "math-2022:S1:GG:PM",
      "slug": "math-2022",
      "curriculum": "义务教育数学课程标准（2022年版）",
      "stage": "第一学段（1~2年级）",
      "domain": "图形与几何",
      "theme": "图形的位置与运动",
      "summary": "用上、下、前、后、左、右和东、南、西、北描述位置；直观感知平移、旋转和轴对称现象。"
    },
    {
      "code": "math-2022:S1:SP",
      "slug": "math-2022",
      "curriculum": "义务教育数学课程标准（2022年版）",
      "stage": "第一学段（1~2年级）",
      "domain": "统计与概率",
      "theme": "数据的收集与整理",
      "summary": "事物的比较、分类与简单的数据收集整理，初步感受数据的意义与随机现象。"
    },
    {
      "code": "math-2022:S1:PP",
      "slug": "math-2022",
      "curriculum": "义务教育数学课程标准（2022年版）",
      "stage": "第一学段（1~2年级）",
      "domain": "综合与实践",
      "theme": "主题活动",
      "summary": "以主题活动经历发现问题、提出问题、分析和解决问题的过程，积累数学活动经验。"
    },
    {
      "code": "math-2022:S2:NA:NO",
      "slug": "math-2022",
      "curriculum": "义务教育数学课程标准（2022年版）",
      "stage": "第二学段（3~4年级）",
      "domain": "数与代数",
      "theme": "数与运算",
      "summary": "万以上数的认识与十进制计数法；三位数乘两位数、除数是两位数的除法；小数的意义、性质和加减法；整数四则运算顺序与加法、乘法运算律。"
    },
    {
      "code": "math-2022:S2:NA:AR",
      "slug": "math-2022",
      "curriculum": "义务教育数学课程标准（2022年版）",
      "stage": "第二学段（3~4年级）",
      "domain": "数与代数",
      "theme": "数量关系",
      "summary": "速度×时间=路程等常见数量关系与估算策略；用字母表示数和等量关系的萌芽，为方程思想做铺垫。"
    },
    {
      "code": "math-2022:S2:GG:GM",
      "slug": "math-2022",
      "curriculum": "义务教育数学课程标准（2022年版）",
      "stage": "第二学段（3~4年级）",
      "domain": "图形与几何",
      "theme": "图形的认识与测量",
      "summary": "线段、射线、直线与角的度量（量角器）；相交、平行；平行四边形、梯形和三角形的认识；面积单位、长方形和正方形面积；公顷与平方千米。"
    },
    {
      "code": "math-2022:S2:GG:PM",
      "slug": "math-2022",
      "curriculum": "义务教育数学课程标准（2022年版）",
      "stage": "第二学段（3~4年级）",
      "domain": "图形与几何",
      "theme": "图形的位置与运动",
      "summary": "用数对确定位置；轴对称图形的再认识与图形运动。"
    },
    {
      "code": "math-2022:S2:SP",
      "slug": "math-2022",
      "curriculum": "义务教育数学课程标准（2022年版）",
      "stage": "第二学段（3~4年级）",
      "domain": "统计与概率",
      "theme": "数据的收集与表达",
      "summary": "平均数；条形统计图与复式统计表；感受简单随机现象可能性的大小。"
    },
    {
      "code": "math-2022:S2:PP",
      "slug": "math-2022",
      "curriculum": "义务教育数学课程标准（2022年版）",
      "stage": "第二学段（3~4年级）",
      "domain": "综合与实践",
      "theme": "主题活动",
      "summary": "主题式学习活动与数学广角类问题（沏茶与烙饼的优化、鸡兔同笼的假设、植树问题的间隔等）。"
    },
    {
      "code": "math-2022:S3:NA:NO",
      "slug": "math-2022",
      "curriculum": "义务教育数学课程标准（2022年版）",
      "stage": "第三学段（5~6年级）",
      "domain": "数与代数",
      "theme": "数与运算",
      "summary": "小数乘除法；因数与倍数；分数的意义、性质与四则运算；负数的初步认识。"
    },
    {
      "code": "math-2022:S3:NA:AR",
      "slug": "math-2022",
      "curriculum": "义务教育数学课程标准（2022年版）",
      "stage": "第三学段（5~6年级）",
      "domain": "数与代数",
      "theme": "数量关系",
      "summary": "比和百分数的意义与应用；正比例与反比例；用比例和方程思路（简易方程已调整至初中）分析数量关系。"
    },
    {
      "code": "math-2022:S3:GG:GM",
      "slug": "math-2022",
      "curriculum": "义务教育数学课程标准（2022年版）",
      "stage": "第三学段（5~6年级）",
      "domain": "图形与几何",
      "theme": "图形的认识与测量",
      "summary": "多边形的面积、圆的周长与面积、扇形；长方体和正方体的表面积、体积与容积单位；圆柱和圆锥的认识。"
    },
    {
      "code": "math-2022:S3:GG:PM",
      "slug": "math-2022",
      "curriculum": "义务教育数学课程标准（2022年版）",
      "stage": "第三学段（5~6年级）",
      "domain": "图形与几何",
      "theme": "图形的位置与运动",
      "summary": "比例尺；根据方向（角度）和距离确定物体的位置。"
    },
    {
      "code": "math-2022:S3:SP",
      "slug": "math-2022",
      "curriculum": "义务教育数学课程标准（2022年版）",
      "stage": "第三学段（5~6年级）",
      "domain": "统计与概率",
      "theme": "数据的收集与表达",
      "summary": "折线统计图、扇形统计图；平均数、中位数、众数；可能性大小的定量描述。"
    },
    {
      "code": "math-2022:S3:PP",
      "slug": "math-2022",
      "curriculum": "义务教育数学课程标准（2022年版）",
      "stage": "第三学段（5~6年级）",
      "domain": "综合与实践",
      "theme": "主题活动",
      "summary": "项目式与跨学科主题学习，数学广角类问题（找次品、打电话、鸽巢问题、数与形等）。"
    },
    {
      "code": "math-2022:S4:NA:NS",
      "slug": "math-2022",
      "curriculum": "义务教育数学课程标准（2022年版）",
      "stage": "第四学段（7~9年级）",
      "domain": "数与代数",
      "theme": "数与式",
      "summary": "有理数、实数的概念与运算；代数式、整式与分式的概念、运算与因式分解；数与式的意义与变形。"
    },
    {
      "code": "math-2022:S4:NA:EI",
      "slug": "math-2022",
      "curriculum": "义务教育数学课程标准（2022年版）",
      "stage": "第四学段（7~9年级）",
      "domain": "数与代数",
      "theme": "方程与不等式",
      "summary": "一元一次方程、二元一次方程组、一元二次方程与可化为整式方程的分式方程；一元一次不等式（组）的解法与建模应用。"
    },
    {
      "code": "math-2022:S4:NA:FN",
      "slug": "math-2022",
      "curriculum": "义务教育数学课程标准（2022年版）",
      "stage": "第四学段（7~9年级）",
      "domain": "数与代数",
      "theme": "函数",
      "summary": "函数的概念与三种表示；一次函数、反比例函数、二次函数的图像与性质，以及函数与方程、不等式的联系。"
    },
    {
      "code": "math-2022:S4:GG:GP",
      "slug": "math-2022",
      "curriculum": "义务教育数学课程标准（2022年版）",
      "stage": "第四学段（7~9年级）",
      "domain": "图形与几何",
      "theme": "图形的性质",
      "summary": "点、线、面、角与相交线、平行线；三角形与四边形（含多边形）的性质与判定；圆的性质；尺规作图；定义、命题、定理与证明。"
    },
    {
      "code": "math-2022:S4:GG:GT",
      "slug": "math-2022",
      "curriculum": "义务教育数学课程标准（2022年版）",
      "stage": "第四学段（7~9年级）",
      "domain": "图形与几何",
      "theme": "图形的变化",
      "summary": "图形的轴对称、旋转、平移、相似与位似；图形的投影与视图；利用图形运动认识图形性质。"
    },
    {
      "code": "math-2022:S4:GG:GC",
      "slug": "math-2022",
      "curriculum": "义务教育数学课程标准（2022年版）",
      "stage": "第四学段（7~9年级）",
      "domain": "图形与几何",
      "theme": "图形与坐标",
      "summary": "平面直角坐标系；用坐标刻画图形的位置与运动，建立几何直观与代数表达的桥梁。"
    },
    {
      "code": "math-2022:S4:SP:SA",
      "slug": "math-2022",
      "curriculum": "义务教育数学课程标准（2022年版）",
      "stage": "第四学段（7~9年级）",
      "domain": "统计与概率",
      "theme": "抽样与数据分析",
      "summary": "数据的收集、整理、描述与分析；平均数、中位数、众数、方差等统计量的意义与应用；样本估计总体。"
    },
    {
      "code": "math-2022:S4:SP:PR",
      "slug": "math-2022",
      "curriculum": "义务教育数学课程标准（2022年版）",
      "stage": "第四学段（7~9年级）",
      "domain": "统计与概率",
      "theme": "事件的概率",
      "summary": "通过频率估计概率；简单随机事件（含古典概型）的概率计算；体会随机现象的规律性。"
    },
    {
      "code": "math-2022:S4:PP",
      "slug": "math-2022",
      "curriculum": "义务教育数学课程标准（2022年版）",
      "stage": "第四学段（7~9年级）",
      "domain": "综合与实践",
      "theme": "项目式学习",
      "summary": "在真实情境中综合运用数与代数、图形与几何、统计与概率知识，经历发现、提出、分析、解决问题的项目式学习过程。"
    },
    {
      "code": "chinese-2022:S1:BQ",
      "slug": "chinese-2022",
      "curriculum": "义务教育语文课程标准（2022年版）",
      "stage": "第一学段（1~2年级）",
      "domain": "语言文字积累与梳理（基础型）",
      "theme": "识字与写字",
      "summary": "认识常用汉字约1600个，其中约800个会写；学习汉语拼音和独立识字方法，掌握基本笔画、笔顺和间架结构。"
    },
    {
      "code": "chinese-2022:S1:PR",
      "slug": "chinese-2022",
      "curriculum": "义务教育语文课程标准（2022年版）",
      "stage": "第一学段（1~2年级）",
      "domain": "实用性阅读与交流（发展型）",
      "theme": "阅读与表达",
      "summary": "阅读浅显的儿歌、故事和浅近的实用文本，乐于表达和交流，讲述简短见闻。"
    },
    {
      "code": "chinese-2022:S1:LR",
      "slug": "chinese-2022",
      "curriculum": "义务教育语文课程标准（2022年版）",
      "stage": "第一学段（1~2年级）",
      "domain": "文学阅读与创意表达（发展型）",
      "theme": "阅读与表达",
      "summary": "诵读儿歌、童谣和浅近古诗，展开想象，获得初步的情感体验，乐于写话。"
    },
    {
      "code": "chinese-2022:S1:CR",
      "slug": "chinese-2022",
      "curriculum": "义务教育语文课程标准（2022年版）",
      "stage": "第一学段（1~2年级）",
      "domain": "思辨性阅读与表达（发展型）",
      "theme": "阅读与表达",
      "summary": "结合生活经验对读物中的简单话题发表自己的看法，说清理由。"
    },
    {
      "code": "chinese-2022:S1:WB",
      "slug": "chinese-2022",
      "curriculum": "义务教育语文课程标准（2022年版）",
      "stage": "第一学段（1~2年级）",
      "domain": "整本书阅读（拓展型）",
      "theme": "阅读与鉴赏",
      "summary": "阅读浅近的童话、寓言、故事等整本书，乐于与同伴交流阅读感受。"
    },
    {
      "code": "chinese-2022:S1:IL",
      "slug": "chinese-2022",
      "curriculum": "义务教育语文课程标准（2022年版）",
      "stage": "第一学段（1~2年级）",
      "domain": "跨学科学习（拓展型）",
      "theme": "梳理与探究",
      "summary": "在语文实践活动中围绕共同话题收集简单资料，与同伴合作完成小任务。"
    },
    {
      "code": "chinese-2022:S2:BQ",
      "slug": "chinese-2022",
      "curriculum": "义务教育语文课程标准（2022年版）",
      "stage": "第二学段（3~4年级）",
      "domain": "语言文字积累与梳理（基础型）",
      "theme": "识字与写字",
      "summary": "累计认识常用汉字约2500个，其中约1600个会写；用音序、部首查字法独立识字，积累词语和精彩句段。"
    },
    {
      "code": "chinese-2022:S2:PR",
      "slug": "chinese-2022",
      "curriculum": "义务教育语文课程标准（2022年版）",
      "stage": "第二学段（3~4年级）",
      "domain": "实用性阅读与交流（发展型）",
      "theme": "阅读与表达",
      "summary": "阅读叙事、说明等常见文本，把握主要内容；能用便条、书信等简单实用文进行书面交流。"
    },
    {
      "code": "chinese-2022:S2:LR",
      "slug": "chinese-2022",
      "curriculum": "义务教育语文课程标准（2022年版）",
      "stage": "第二学段（3~4年级）",
      "domain": "文学阅读与创意表达（发展型）",
      "theme": "阅读与表达",
      "summary": "阅读散文、诗歌、童话等文学作品，品味语言，展开想象，尝试创编。"
    },
    {
      "code": "chinese-2022:S2:CR",
      "slug": "chinese-2022",
      "curriculum": "义务教育语文课程标准（2022年版）",
      "stage": "第二学段（3~4年级）",
      "domain": "思辨性阅读与表达（发展型）",
      "theme": "阅读与表达",
      "summary": "阅读说理性和叙事中含思辨成分的文本，学习提问、比较和推断，清楚地表达观点。"
    },
    {
      "code": "chinese-2022:S2:WB",
      "slug": "chinese-2022",